{
  "schema_version": "ats.acceptance_receipt.v1",
  "receipt_id": "candidate:fixture-specify-stale-policy:6ec21218ff8acb39",
  "standard": "ATS-1",
  "spec_version": "1.0.0-draft.1",
  "source_sha256": "93261226b7f79d31b419f98b8e1917d557ee22e0a8a31fc1f9ad84a2c5ffd9e3",
  "policy_snapshot_id": "policy-fixture-specify",
  "policy_snapshot_sha256": "7b30c3e27567413e22ebf983660a1687590b3ceab50ca17ad31f4f9c34766d2f",
  "implementation": {
    "name": "ats",
    "version": "0.1.0",
    "rule_registry_version": "1.0.0-draft.1",
    "lexicon_version": "1.0.0-draft.1",
    "parser_version": "markdown-it-py/commonmark@4.2.0"
  },
  "profiles": [
    "SPECIFY"
  ],
  "deterministic_summary": {
    "required_passed": 22,
    "required_failed": 0,
    "required_unavailable": 1,
    "advisory_findings": 0
  },
  "semantic_summary": {
    "proposed": 0,
    "accepted": 0,
    "rejected": 0,
    "waived": 0,
    "unresolved": 0,
    "abstained": 1
  },
  "conformance": {
    "mechanical": "PASS",
    "profile": "PASS",
    "semantic_review": "UNAVAILABLE",
    "preservation": "NOT_APPLICABLE",
    "forecast_calibration": "INSUFFICIENT_EVIDENCE"
  },
  "adjudicator": "arq-acceptance-authority",
  "created_at": "2026-08-03T00:00:00Z",
  "output_sha256": "a69aeffb480a272c28062948c2746d798ffe2264acea498e3c0f95322682d467",
  "receipt_sha256": "22a9e4f0f8ce385caceacd2fc919a29e7c9b070a022b312427672ae648d36072"
}
